{
  "id": "example-podcast-001",
  "source": {
    "url": "https://www.youtube.com/watch?v=VIDEO_ID",
    "provider": "youtube",
    "channelId": "CHANNEL_ID",
    "channelName": "Canal autorizado",
    "sourceVideoId": "VIDEO_ID",
    "rightsProfile": "approved-clipping",
    "discoveredAt": "2026-09-10T21:00:00Z"
  },
  "analysis": {
    "curationMode": "podcast",
    "customPrompt": "Priorize histórias, opiniões fortes, explicações úteis e trechos que funcionem isoladamente.",
    "clipCount": 12,
    "minDurationSec": 20,
    "maxDurationSec": 90,
    "minSelectionScore": 70,
    "minContextIntegrityScore": 85,
    "speakerFraming": "dynamic",
    "captions": true,
    "tightenCuts": true,
    "autoZoom": true
  },
  "output": {
    "aspectRatios": ["9:16"],
    "writeMetadataJson": true,
    "writeSrt": true,
    "publishMode": "draft",
    "destinations": ["youtube-shorts", "tiktok", "instagram-reels"]
  },
  "feedback": {
    "collectMetrics": true,
    "checkpointsHours": [1, 6, 24, 72, 168],
    "learningProfile": "podcast-default"
  }
}
